<?xml version="1.0" encoding="UTF-8"?>
<!DOCTYPE sawon SYSTEM "sawon.dtd">
<sawon>
  <list>
    <name>aaa</name>
    <dept>aaa</dept>
    <tel>aaa</tel>
  </list>
  <list>
    <name>bbb</name>
    <dept>bbb</dept>
    <tel>bbb</tel>
  </list>
</sawon>